提问,回答
入职登记表中需要增加字段怎么操作,"在自定义信息集中先查看是否有需要的字段。若有点击编辑里面是否有入职配置。需开启。
若自定义信息集中也没有，需要先创建字段并将入职配置开启，再到【员工设置】-【入职登记表设置】中设置是否需要显示和必填的情况。"
手机花名册团队信息授权权限是怎么确认的,"花名册查看权限，仅有部门负责人有
1.员工只是部门负责人，手机花名册可以查看部门下员工的花名册信息；
2.员工是部门负责人，并且有在账号-权限管理-用户管理处，没有给管理范围授权，则是不显示花名册信息；
3.员工是部门负责人，并且有在账号-权限管理-用户管理处，有给管理范围授权，以管理范围授权的部门为准。"
员工在使用i人事APP在我的-我的档案里的信息有些需要HR审批才能修改应该怎么设置,在员工-员工设置-手机花名册设置中设置员工可修改的字段范围
如果不想让某个员工的联系信息出现在手机里的通讯录如何操作,HR在【员工】-【员工设置】-【通讯录设置】里，在该员工后面选择“全部隐藏”即可。
我们在办理员工入职时需要线上收集如学历证书和学位证书等资料,【员工】-【员工设置】-【入职设置】可以设置是否开启线上收集入职材料，并且可以设置上传的资料是否为必填。
需要设置员工求职登记时不能选择30天之外的最快到岗时间,员工-员工设置-入职设置中设置限制
员工发起转正申请最多可提前7天应该怎么设置,员工-员工设置-转正设置-规则设置中调整
员工发起调动申请只能搜索到我们集团下的公司不能搜索整个集团怎么操作,【员工】-【员工设置】-【调动设置】中设置可搜索的范围
调动审批通过后我不想再去点这个确认调动是否可以自动确认调动,【员工】-【员工设置】-【调动设置】勾选调动审批通过后自动确认
发起调动时怎么取消掉里面的一些必填设置设置成非必填,在【员工设置】-【调动设置】的表单设置处可设置是否必填
我们公司要求正式员工离职申请时至少提前30天发起申请试用期至少提前7天怎么设置,【员工-员工设置-离职设置】，只能统一设置提前多少天申请离职，暂不支持根据“正式员工和试用期员工”进行设置。
我们公司需要设置第三次签订合同时就默认为无固定期限劳动合同了应该怎么设置,【员工】-【员工设置】-【合同设置】
入职登记表的有些项目是不需要的,【员工】-【员工设置】-【入职登记表设置】中取消不需要的字段
入职表单内容能不能添加字段找不到添加字段的选项,入职登记表若增加字段。需要先在自定义信息集中有这个字段（没有就创建），并将入职配置是否有效开启，然后到入职登记表编辑相关情况。若是附件材料要增加是先在入职设置-入职材料添加收集内容。最后到入职登记表设置中编辑。
工号编号如何处理,"一、支持按部门和员工类型设置多套工号方案
二、新增员工时，会根据员工所属部门和员工类型自动检查匹配的工号方案，并生成对应工号"
有些员工是因为特殊问题离职的是否可以设置下次如果入职时系统会有提醒,员工离职可加入黑名单【员工-员工设置-黑名单】
怎么将加入黑名单的人员剔除,【员工】-【员工设置】-【黑名单】找到人员选择无效或者删除即可
如何设置某员工为部门负责人,在组织的【部门】或【组织架构图】中，【编辑】在弹框中可以点击【部门负责人】选择某员工为该部门的负责人。
部门处修改了部门负责人是否可以查到是谁修改的,可以在变更记录中查看修改记录
部门处没有变更记录是什么情况呢,需要主管理员才可以查看此处的变更记录。
工作地点有什么用,"工作地点是指劳动者所在岗位的具体地理位置，比如某集团公司有北京总部、上海分部、广州分部等，可以在此记录，然后在员工-花名册-员工基础信息里维护【工作地点】时才可以选择到。
如果贵司一家跨区域型企业，或者有多家门店、分支机构的组织，可以在此处维护每个具体的经营地址。"
组织构架图的展示方向可以设置吗,点击设置，可配置组织展示方向，默认展示层级内的最后一级竖向显示
请问增加职位在哪里增加,新职位可以在【组织】-【职位体系】-【职位】中新增
增加职位时提示“职位名称重复”但筛选没有重复名称的是什么情况呢,注意：在设置中，将停用的展示出来，再进行筛选，避免停用中有此职位，若是有就不用新建，可以直接启用。
体系表中适用范围怎么改,体系表中的职级适用方式有两种，一种是职位，一种是职务。在【职级体系】-【体系表】中右上角的设置中。此选项选择正确后，对应的职级可点击后面的编辑选择具体的适用范围。
福利方案如何设置养老和医疗不同基数,福利方案-基本设置中关闭统一基数后，就可以单独设置各险种的基数
福利方案里选择完市之后有社保公积金数据但是选择区后就没有数据是什么原因,如果该城市各区都是使用的同一套社保数据，那么只需要选择前两项即可，不需要再选择区了。
社保公积金能不能调整上下限比例等,可以的，新增社保、公积金方案时，各险种及公积金的上下限、比例、保留小数计算规则、生效月等均可自定义设置。
给子账号分配了 社保模块 看不到方案数据,福利方案需要分享后才能查看
员工福利档案里面员工社保基数调整了为什么台账里计算没有变化,在员工福利档案里调整完员工的社保基数后，在【福利台账】-【重新核算】点击按钮后进行操作，才可根据最新的员工基数进行计算。
福利台账怎么分享,福利台账右上角分享按钮
如何生成社保台账,"按照如下顺序：
1.首先在【福利管理】-【福利设置】里，添加社保、公积金方案；
2.在【福利管理】-【员工福利档案】里面进行编辑员工的福利方案，缴纳基数与社保、公积金账号等信息。福利信息在员工花名册里面也可进行编辑。
3.在【福利管理】-【福利台账】点击新增台账添加人员后点击核算，核算成功点击存档，存档之后不可进行编辑。只有存档之后的福利台账才能在薪资核算时参与计算。"
社保公积金有补缴等调整的话应该在哪个项目进行调整,可在福利台账的社保、公积金个人调、公司调项目中输入或导入。 个人调填写后，合计会自动刷新，不用点重新核算  
社保公积金基数已经改为0重新核算了一下为什么社保 公基金还有数,员工档案的申报基数为0的话，会根据员工适用的社保方案里各险种的基数下限计算 
主账号可以建立多个分公司同一月份的台账吗,"不可以，目前一个账号一个月只能建立一个福利台账。
 福利台账里面，就增加不上这个人"
福利台账里面增加不上某个人,需要检查一下员工的社保开始缴纳月份是否在本次福利台账月份及之前。
公司模板下发时选择的允许修改和不允许修改主要是可以修改哪些内容,允许修改：员工通过模版复制创建的薪资方案中可以自行增加项目、修改公式、考勤计薪规则等。 不允许修改：员工通过模版复制创建的薪资方案中不可以自行增加项目、修改公式、考勤计薪规则等。
公司模板是按用户下发还是按角色下发,公司模板目前只能按角色下发的给子账号
薪资项设置时进位规则有哪几种与最多可以保留几位小数,进位规则有原始数据、四舍五入、向上舍入、向下舍入，最多可保留5位小数 。
添加一个自定义薪资项目哪些内容是必选必填的,名称，类型，进位规则 为必填项
员工自定义信息集里文本项与长文本项哪项可以在添加系统项目中选到,文本项可以在添加薪资项的时候应用到，长文本不能被引用。
添加薪资系统项目有哪三大类,目前添加系统项目三大类为薪资项目、员工基本信息、考勤信息 。
哪些类型的薪资项是可以设置为薪资档案可引用,"税前加项-工资 
税前加项-税前津补贴 
其他项-文本项"
为什么我的账号在薪资项目功能模块下没有“操作日志”按钮,子账号如果需要查看操作日志首先需要主账号授予权限“操作日志的权限”
强制使用是什么意思,强制引用的薪资项会出现在每一个薪资方案当中 。
怎么快速找到修改过系统名称的薪资项,"可以看一下薪资项前面是否有小红点，修改过系统薪资项的名称的薪资项前面会显示小红点 

我要将现有的多个薪资项目更新一下薪资档案可引用、有效、强制使用三项设置，怎么操作方便？
勾选需要修改的薪资项点击批量编辑即可"
导入的申报月份需要和薪资方案设置中的哪个日期对应,与薪资方案上的税期月份对应
小计是哪几项之和,累计子女教育+累计住房贷款利息+累计住房租金+累计赡养老人+累计继续教育+累计其他扣除+准予扣除的捐赠额
累计专项附加及其他扣除的导入数据来源是什么,来源是社保局的数据，每月导入时需要导入该年度的当前累计数据 ，导入时需要与当前核算方案的税期月份对应。
税延养老保险是什么,所谓税延型养老保险，是指投保人在税前列支保费，等到将来领取保险金时再缴纳个人所得税，这样可略微降低个人的税务负担，并鼓励个人参与商业保险、提高将来的养老质量。
企业年金和职业年金有什么区别,职业年金：是指公职人员基本养老保险之外的补充养老保险。 企业年金：是指企业及其职工在依法参加基本养老保险的基础上，自愿建立的补充养老保险制度。
累计专项附加及其他扣除有哪些具体的数据项,累计子女教育、累计继续教育、 累计住房贷款利息 、累计住房租金、 累计赡养老人 、企业(职业)年金 、商业健康保险、 税延养老保险、 其他、 累计其他扣除、 准予扣除的捐赠额
为什么新员工导入累计应纳税额提示非台账人员,因为新入职的员工是在系统上没有累计应纳税所得额的，建议可以在线下核算好员工薪资后，将线下核算的文件导入薪资方案中，导入后存档，这样系统从下个月开始就会抓取历史台账中的数据自动累计
累计应纳所得额中数据来源,"计应纳所得额中数据来源：下列是举例税期5月的累计应纳税所得额表数据生成来源
5月累计收入=累计应纳税所得额中4月累计收入+5月薪资台账中【当月应发月薪资合计】
5月累计社保个人合计=累计应纳税所得额中4月数据+5月薪资台账中【社保个人合计】
5月累计社保公积金合计=累计应纳税所得额中4月数据+5月薪资台账中【公积金个人合计】
5月历史累计减除费用=5月薪资台账中【当前累计减除费用】
5月累计月度薪金税=4月累计月度薪金税+5月薪资台账中【当月应扣月度薪金税】

同理，当薪资核算税期为5月，那累计数据就是取累计应纳税所得额表中税期为4月累计数据。
当前累计应发月薪资合计=累计应纳税所得额中4月累计收入+核算方案中当月应发月薪资合计
当前累计社保个人合计=累计应纳税所得额中4月累计社保个人合计+核算方案中社保个人合计
当前累计公积金个人合计=累计应纳税所得额中4月累计公积金个人合计+核算方案中公积金个人合计
当月月度薪金税=当前累计月薪金税-累计应纳税所得额中4月累计月度薪金税。"
累计应纳税所得额里的哪个字段是员工当月实应缴税的数据,累计应纳税所得额里 当月应扣月度薪金税
初始化个税扣缴义务人是什么意思,初始化个税扣缴义务人将在 3 次后消失，累计值按照个税扣缴义务人进行分别累计，为避免错误，请谨慎初始化，将按照花名册设定的个税扣缴义务人进行初始化，请确保已为所有员工设定好个税扣缴义务人。
取数这里有个钉钉取数请问这是指可以直接联动钉钉打卡的数据吗,使用钉钉对接的客户，在数据采集-考勤引用中就会有钉钉考勤取数，可直接取用钉钉上的考勤数据。
考勤引用点击后同步置灰,需要检查一下薪资方案中是否设置了关联考勤
为什么我导入考勤数据提示重复,如果其他HR已经导入过同样的月份同样的人员那您这里再导入也是会提示重复的 。
考勤引入的三种方式有什么区别,导入是需要从系统下载模板后填写数据导入，钉钉导入是可以直接导入钉钉导出的文件，取数是在系统里面直接取用考勤数据 。
导入了考勤数据为什么在薪资核算当中没有引用到,先看一下是否与薪资方案上引用的考勤月份一致，需要注意只有锁定状态的考勤数据才能被引用到 。
考勤数据导入后可以在薪资核算当中引用吗,可以，导入与在系统上取的考勤数据锁定后都是可以在薪资核算当中引用到的
考勤数据导入时出（缺）勤天数列是否可以填小数,不可以，出（缺）勤天数字段只能填写整数，病事假等字段可以填写具体的小时数。
考勤引用并且锁定了为什么核算还是提示员工没有考勤数据,"1、请检查下方案设置中是否设置了关联考勤
2、 确认下考勤锁定月份是否是方案中关联的对应月份。"
薪资项目设置的保留1位有效数字怎么核算保留了2位,请检查以下方案薪资规则设置中薪资项的小数位数设置或者公司模板检查下薪资规则设置中薪资项的小数位数设置：
薪资方案怎么删除薪资项,方案薪资规则设置中删除，强制项需要在薪资项目取消下强制，回到薪资设置才可删除
薪资所属月怎么调整,薪资核算界面调整
二次入职的员工减除费用怎么调整,如有需要可以在薪资档案中调整个税扣缴义务人生效日期，员工的减除费用是根据个税扣缴义务人生效日期自动计算的。
为什么员工的入离职调整计算不出来,要在数据采集导入考勤的，计算入离职调整，一定需要符合前提条件：1、在职计薪天数非0 2、在职计薪天数和月标准不能相等  
为什么存档9月的工资后直接开始核算11月的工资了, 因为这个薪资方案规则设置中，设置的薪资周期是下月1日至下月最后一天，所以薪资所属月是2022-10的工资，计算的是2022-11-01到2022-11-30的工资。  
如果在新建月度薪资台账时还没有先建好福利台账是否可以,"可以。但系统将无法自动将福利台账里的个人应扣发的社保、公积金等数据自动关联到薪资表里。
所以我们建议您：每月可以先建立福利台账，这样在核算薪资台账时，系统会自动将这一数据引入到薪资台账里进行核算。"
为什么我新建了薪资台账/福利台账以后发现员工数量不对,"主账号可能设置了子帐号，把另一部分员工核算薪资的数据权限赋予给了另外子帐号。
系统规定：子账号只能核算自己薪资数据权限范围内的人员。
子帐号核算完薪资以后，归档，则可提交至主帐号。主帐号可以合并成整体的月度薪资报表。"
为什么我不能编辑薪资方案里面的薪资项,不能编辑有两种情况，第一种是没有编辑权限，第二种该薪资方案使用的是不可修改的公司模板
为什么导入薪资台账数据不成功,"可能有如下原因：
1.导入的原始表，和系统模版不一致，因为有先后的运算关系，薪资报表和系统台账里的项目无论是内容、还是顺序都必须保持一致；
2.导入的原始表中的数据格式不对，比如说时间格式应该是文本格式：2015-07；
3.您的原始excel表中，有相关链接表得出的数据，必须去除链接。去除的办法是您需要复制下原始表中的数据（仅复制数据，不要复制格式），到一张新的表中即可."
薪资方案如何删除,需要先停用后删除 ，特别注意：删除方案后，该方案的历史台账将无法撤回。
历史台账撤回提示“该薪资账期日期不是最新一条不允许撤销之前月份的账期”是为什么,撤回历史台账需要注意必须先撤回月份最新的数据。
什么时候需要使用薪资核算-附加人员功能,"附加人员是变动前属于您核算权限范围内，变动后不在您核算权限范围内的人员，需要核算薪资的情况。
适用场景：1）本月需要核算前半段工资；
                 2）本月需要核算整月工资（但不支持调薪调整计算）。

如果需要使用是需要主账号在企业设置-角色管理里面开启"
薪资导入归档后还可以更改吗,需要撤回台账才能修改，修改后再重新存档  。
薪酬模块薪酬数据导入是怎么操作的 ,导入薪资数据首先需要创建薪资方案，如果所有的数据都直接导入线下的数据，您可以点击不核算直接导入 。
怎么能修改员工的薪资档案里的关联薪资方案,"在薪资-薪资核算，对应的方案，更多-规则设置，适用员工处。
不对的可以进入方案去掉。也可以在需要的方案中加入。"
薪资核算里的采集数据考勤取数的时候如何做到员工同步不用每次添加," 给员工关联好薪资方案，先确认好薪资方案的核算人员，然后再数据采集。
场景一：考勤引用的方案未开启核算那自动取方案中关联的员工。
场景二：考勤引用的方案已开启核算那会自动取薪资方案中正在参与核算员工的考勤数据。  "
某个员工怎么改成非正常呢需要离职申报,需要在薪资档案中添加一条离职记录再报送 ，可检查一下员工薪资档案是否存在已离职的个税扣缴义务人记录。
人员信息表中的人员状态正常与不正常是什么意思,"正常是(本期新增和连续报税人员),非正常是(本期减少报税人员)"
撤回8月台账8月工资单是不是也会被撤回,是的
在后台发送工资单以后发现有错如何处置,可以直接在工资单中对当月已发送工资单进行撤回。撤回以后，员工手机端就无法查看此条工资单。
为什么我在电脑端已经发送了工资单但员工手机上未收到,"1.若薪资台账中出现该员工的信息和花名册中信息不一致（身份证号、手机号、姓名），出于安全原因，该员工的薪资单将不会发放到员工手机端。
2.员工手机端是在HR发送工资单之后才关联公司的。"
薪资单只能在薪资台账归档以后才可以发放吗,是的。主要是为了保证数据的严肃性。
员工工资单为什么显示不全,工资单仅显示非空项目，若是在薪资台账中，某些工资项未填写数据（包括0），那么在工资单中此项也不显示。
如何发放薪资单到员工手机端,"薪资核算完成以后，核实无误进行存档。存档后生成薪资台账与工资单。在核算中系统是默认保存薪资的核算进度，当月的薪资存档后不可进行编辑。
系统只允许存档以后的薪资台账发放薪资单，在工资单中点击前往发放，发放后员工即可在手机APP上个人薪资中收到。
特殊情况下，HR可以通过撤回当月薪资台账，将存档后的薪资台账撤回，并重新核算。"
如何查看工资单,"1.员工登录自己的手机App端，在应用里面有一个【我的薪资】，点击【我的薪资】输入薪资查询密码后即可查看工资。
2.如果是第一次使用需要设置薪资查询密码"
如何在微信上查看工资单,工资单通过微信方式发送后，需要员工在微信上关注“i人事服务号”然后在这个服务号里面查看。
如何撤回工资单,工资单是根据薪资台账生成的，撤回对应的薪资台账就会自动撤回工资单 。
怎么分享工资单,在工资单结果中点击分享。
工资单字段能否自定义,系统默认的工资单字段不可进行修改。如需要添加自定义字段，需要先在薪资项目里面进行添加，然后再在新增方案设置里面进行添加该薪资项。
设置了工资单显示的项目为什么工资单列表里面的没有发生变化,设置工资单需要注意，新的设置不影响已经生成工资单的台账，只会影响设置工资单时候存档的台账 。
员工的工资条可以显示公司与部门这些信息吗,可以的，在工资单设置中添加需要显示的薪资项。
为什么调薪审批应用范围是所有人APP上还是看不到,"调薪审批需要新建审批，后引用调薪的套件
 调薪审批流程目前只针对了管理员和HR开放，且需要开启相应权限才能申请，员工端是看不到的。hr要发起是在薪资-薪资档案-调薪审批发起的"
薪资项目引用设置有什么用,快速配置员工薪资档案需要引用的薪资项，勾选上即可在员工薪资当中维护员工的薪资金额。
合计金额设置有什么作用,可以通过设置把员工薪资档案里面的各项薪资取和显示到员工薪资档案里面 。
残疾人免税设置如何使用,"1、设置好残疾人免税方案，选择第一种减免规则的情况下 
2、在员工薪资档案内给指定员工绑定好残疾人免税方案 
3、薪资表内搜索“税费合计”，把里面的“当月应扣月度薪金税”去除，再找到“当月应扣月度薪金"
右上角的设置有哪两项操作,残疾人免税规则，合计金额设置 。
未关联方案人员是什么意思如有未关联人员应该怎么操作,未关联方案人员是还没有关联薪资方案的员工，可点击按钮进行关联，也可以在薪资方案的规则设置-基本设置-选择人员位置进行关联 。
员工薪资档案导入类型有几种,导入员工薪资档案两种导入类型，分别是导入薪资项目与导入个税扣缴义务人 。
操作记录有哪两大类查询,目前可分薪资项目操作记录，个税扣缴义务人的操作记录 。
可以单独调薪吗,可以在员工薪资档案中走调薪流程。
为什么薪资档案里面个税扣缴人无法修改其他公司,修改的个税扣缴义务人生效日期存在已申报或者正在申报的信息，需要重新选择生效日期  
问下关联薪资方案里面的红色感叹号什么意思  ,"红色感叹号指的是方案被停用了，您可以点击感叹号查看提示  
 "
员工公司台账可以按季度查询吗, 可以，按月筛选即可 。
请问薪资报表-个税报表中的个税报表如何删除,薪资台账存档后，在个税报表-报表设置中设置之后生成的，不设置就不能生成，生成后如果台账撤回了也会一并删除，重新存档后又将再次生成  
如何生成网银报表/个税报表,网银报表和个税报表是在薪资台账生成并存档以后，会自动生成当月度的网银报表、个税报表。这两张表里的数据全部是从薪资台账中抓取过来的，HR将不能再修改。若有错误，HR只能在薪资台账里进行修改。
个税报表和网银报表里是何时生成的,个税报表和银行导盘都是从薪资台账中获得数据，因此，在薪资台账归档时，系统会自动生成当月的个税报表和银行导盘。
为什么我在花名册中有这个人但是排班管理就看不到,排班分组的员工只有相应的排班专员才能看到，如果员工不在所属的排班分组中，那么这个排班分组的排班专员也是看不到的，只有员工所在排班分组中的排班专员才能看到  
手机端划线排班灰色区域不能调整是怎么回事,需要切换下日期
历史排班是什么意思,在班次设置修改班次内容之后，选择更新时间，或者删除班次。排班管理排班左上角会有小点，代表历史班次（之前的班次）
员工的班次变了如何查找原因,可在排班管理查看操作日志
循环排班最长多少天,循环天数不能大于31天
设置了循环排班时遇到法定节假日会怎么排班,以循环排班方式排班
排班管理页面的“更新排班表”按钮提示“不能选择今天及之前的日期,此按钮设置就是不能选择今天及之前的日期。
系统团队考勤设置是在哪里,考勤-出勤记录-团队打卡记录页面右上角的团队设置按钮
钉钉考勤机打卡i人事无记录,钉钉打卡补偿，选择补偿时间段，同步一下打卡记录即可
企信（钉钉）打卡补偿是什么功能,一般是企业微信上有打卡记录，但是由于同步功能受影响，未自动同步到I人事系统中的打卡记录，就可以通过点“打卡补偿”再次同步过来 
打卡记录来源显示APP为什么无法删除,为保证数据准确性，管理员无法删除来源为APP的打卡记录
