提问,回答
怎么操作可以禁止员工登陆APP,花名册解除下手机号绑定即可（花名册邀请后可再次登录）
生日类型如何调整,可在花名册员工详情中修改生日类型
如何让员工登不上自己的APP,花名册解除下手机号绑定即可（花名册邀请后可再次登录）
花名册人员数量超过限制怎么办,如果超出限额， 需联系联系贵司专属的成功经理沟通增购事宜
工号批量修改如何操作,可以，导入的表格中需要员工姓名和手机号（或证件号），来改工号，且需要注意工号不能有重复的。
请问员工的汇报对象怎么维护,花名册可以导出查看之前维护的员工的直属领导是什么。也可以批量导入维护，也可以进入员工详情编辑。选择员工对应汇报类型的汇报对象。
员工的手机号怎么在系统上修改,在员工详情中，编辑的状态下，点手机号前面的问号，解除绑定，即可修改。修改后重新发邀请，员工用新手机号登即可。
员工的工龄数据是持续更新吗,"入职本公司工龄（系统中的司龄）可以自动更新，历史工龄不可以。
当员工入职时，会有一个历史工龄，该工龄是指员工在入职本公司之前，在其他公司的历史累计工龄。该工龄数据是历史数据，由HR填写，员工在本公司工作期间，该数据不会更新。
同时员工入职以后，会有一个司龄。这个数据会按照入职时间自动更新。"
员工的离职日期可以修改吗,"进入已离职了，只有在花名册的已离职中通过导入修改的方式，修改员工的离职日期。
注意：导入时，表格中离职字段都需要有填写再导入。"
员工的离职日期怎么修改,"进入已离职了，只有在花名册的已离职中通过导入修改的方式，修改员工的离职日期。
注意：导入时，表格中离职字段都需要有填写再导入。"
已离职的员工离职日期怎么修改,"进入已离职了，只有在花名册的已离职中通过导入修改的方式，修改员工的离职日期。
注意：导入时，表格中离职字段都需要有填写再导入。"
预生成的排班管理表是按照什么规则生成的,"系统每天会自动生成当前日期之后60天的排班:

A. 已设置“循环排班”人员按照循环生成排班，到期后自动循环下去；

B. 未设置“循环排班”人员按照前30天常用班次进行排班：
30天是指：要排班的起始日期(不是今天)往前推30天；
常用班次说明：取30天内除了休班次以外最常用的班次；
     如果有多个最常用班次，取最近一个；
      如果一个都没有，则认为是新员工；
      常用班次需要和员工所在班组中的班次比对，如果不在里面，可能员工已更换班组，按新班组排班；

新员工：由于取不到30天的常用班次，则取所在班组中上班时间最早的班次；
新班组：取所在班组中上班时间最早的班次；"
招聘模块里录用审批通过后进入花名册的是否会同步他简历中的工作经历、学校信息等,会同步员工上传的身份证照片，但是不会同步工作经历和学校信息。
附加减分扣10是正数10还是负数10,附加减分的分值是需要设置为负数，扣的是-10
评估完成待归档的绩效一直不点归档会出现一段时间不显示吗,没有影响，会一直存在的。
变更了处理人在哪查看操作记录,考核进度里若变更了当前处理人了的，可以点一下考核名称，然后进入变更记录看点击后面的查看可以查看详细内容 。
人脸打卡老是失败,建议在考勤-考勤设置-考勤机-考勤号码中找到该员工后清除人脸信息后重新录入  
请问员工的汇报对象怎么维护,花名册可以导出查看之前维护的员工的直属领导是什么。也可以批量导入维护，也可以进入员工详情编辑。选择员工对应汇报类型的汇报对象。
员工出生日期填成阴历了怎么修改为阳历,可在花名册员工详情中修改生日类型
为什么花名册里的员工有的能选职级有的不能选,职级是关联职位或职务的，需要先选择对应的职位和职务
怎么可以让员工登不上自己的APP,花名册解除下手机号绑定即可（花名册邀请后可再次登录）
上传人员花名册系统提示超限额,如果超出限额， 需联系联系贵司专属的成功经理沟通增购事宜
身份证号报错,"身份证号是强校验信息，如果数字或者格式有错误会提示报错，请核实确认身份证信息。
例如：输入的数据是【中国护照】的，误勾选为【居民身份证】时，数字或格式有错误时就会提示报错。"
花名册中工号是否可以批量修改,可以，导入的表格中需要员工姓名和手机号（或证件号），来改工号，且需要注意工号不能有重复的。
在花名册里新增人员的时候部门是必填但是为什么下拉框没有选项,当下拉框没有选项时，需要先在【组织】-【组织架构】-【部门】处创建需要的部门。
请问员工的直属领导怎么维护,花名册可以导出查看之前维护的员工的直属领导是什么。也可以批量导入维护，也可以进入员工详情编辑。选择员工对应汇报类型的汇报对象。
手机号怎么在花名册修改,在员工详情中，编辑的状态下，点手机号前面的问号，解除绑定，即可修改。修改后重新发邀请，员工用新手机号登即可。
在花名册导入提示部门导入不了,注意：部门在线下表格中需要写完整的部门路径 ，从所属公司依次写，各层级用斜杠隔开  (公司/一级部门/...)
员工的工龄数据是不断自动更新的吗,"入职本公司工龄（系统中的司龄）可以自动更新，历史工龄不可以。
当员工入职时，会有一个历史工龄，该工龄是指员工在入职本公司之前，在其他公司的历史累计工龄。该工龄数据是历史数据，由HR填写，员工在本公司工作期间，该数据不会更新。
同时员工入职以后，会有一个司龄。这个数据会按照入职时间自动更新。"
如果不小心将员工删除了怎么办,目前花名册里面删除员工后无法恢复，只能重新录入信息。
员工花名册录入之后员工列表的名单显示不完整,查看下右下角每页显示数量，可以调整或者分页显示。
已离职员工是否可以直接修改离职日期,"进入已离职了，只有在花名册的已离职中通过导入修改的方式，修改员工的离职日期。
注意：导入时，表格中离职字段都需要有填写再导入。"
如何实现花名册的信息录入,"1.若您有在职员工的数据，可以直接以excel表的形式导入。
适用于员工已经入职的，且人数较多，可一次性全部导入，导入支持精简模板和自定义导入模板的下载。
在设置自定义模版时，需遵循以下原则： 
a. 里面有些维度项，系统已经设置好了备选项，则必须在导入的excel表中该维度下面也采用相同的选项，否则系统将不能识别，无法导入；
b. 导入的 Excel 表表头（第一行）里的列名必须与系统中所选定的表头维度名称完全相同（其中姓名、证件号、手机号码、入职日期是必填的）；
c. 表头维度顺序可与系统中不一致；
d. 可以单独导入几列，适用于单独更新某几列数据。其中姓名必填以及请确保“证件号”、“手机号”、“工号”三者有其一必填，再加上需要单独进行修改的几列数据。
为了方便您导入，我们设置了模版。您可以先下载模版，然后把您excel表的数据按照列分别复制过去，再导入即可。

2.新入职的员工，可以通过手机端办理入职；
通过微信扫码入职的员工，会进入到【员工】-【异动】-【入职】-【入职登记表】中，审批通过后会进入待入职，可以正常发起入职审批，当HR审批完成以后，确认员工后，到了入职日期时间。该员工信息会自动加入到花名册中；
适用于新增入职员工，员工扫码填写入职登记表，无需HR进行员工个人信息的收集。

3.花名册也可以直接新增单个员工的数据或导入。"
为什么员工花名册全部或部分导入不了,"可能有以下原因：
1、您导入的文件不是xls、xlsx（即我们通常所说的excel表）格式文件；
2、您导入的文件的第一行的维度名称，和系统设定的维度名称不一致；
3、您导入的文件中所列内容，不是系统中所备选的内容。比如：婚姻状况，系统中只有“已婚”和“未婚”两种，您的文件中可能含有“离婚”等选项。
4、您导入的Excel文件的第一行，不是花名册维度，而是其他内容；
5、您导入的excel文件里必须包含：姓名、证件类型、证件号、入职日期、手机号这五项，缺少其中一项都导入不进去；
6、您导入的excel表文件中，姓名不同但手机号或身份证号有重复，会被系统默认为是同一个人，就会导不进去；
7、您导入的excel表文件中，有其他非法或特殊字符，不要有公式项，引用项，；
请先下载模版，然后把您excel表的纯数据按照列分别复制过去，再导入即可。"
花名册导出有操作日志吗,花名册有操作日志的功能。目前只有主管理员有此权限，且无法进行权限分配。
花名册操作日志中数据比较多怎么便于查询,可以建立筛选，以时间段来查询。
员工花名册员工详情页可以导出成PDF格式吗,"可以的。
在员工花名册员工详情页点击【打印】按钮，目标打印机这里更改选择【另存为PDF】，保存后即为PDF格式。"
为什么系统会提示该员工尚未关联公司,"出现“尚未关联公司”代表HR未邀请员工绑定所在公司。
“是否关联APP”指的是员工是否在APP上登录过自己的账号关联了公司，如果员工已经在i人事App成功登录，那状态会自动变成“是”；状态为“否”则说明该员工还未在APP上登录。
路径：【员工】-【花名册】-【有XX名员工未绑定去邀请】-选择“一键全部发送”或勾选员工姓名后点击“批量邀请”-【发送】"
生日名单中的数据如何修改,"生日名单的信息，也是随着花名册中的数据自动生成的，且和花名册中数据保持一致的。在缺省状态下，系统自动生成自当前日开始为期一个月的生日名单，HR可以自行筛选日期，生成其他月的生日名单。生日名单也可以导出。
如果某员工在花名册中的生日设置为农历，系统会自动将本年的农历生日转换成本年的公历日期，并显示在生日名单中。"
没有改过密码但是原始密码登录不上是怎么回事,"【初始密码后六位】由花名册注册才是；
短信快捷方式登录后，默认密码为【手机号后六位】。
 若是员工登录过APP，然后有填写过新的密码的。忘记了，可以在账号密码登录的时候点忘记密码设置一个新的密码。"
导入花名册提示第x行数据存在错误怎么去核实,在核实时需要去查看的是第x+1行（提示的第x行是不包括表头的）
在员工花名册勾选了部分人员再点击导出是导出的勾选这部分人员的信息吗,这种情况下是导出的是所有人的信息，只有通过条件筛选之后页面显示的人员，才是精确导出
花名册里的头像与App的头像是一致的吗,不是，花名册的头像只能HR编辑或员工在APP-我的档案里修改；员工在自助端-个人信息和“APP端-我的”头像是一致的。
为什么我们公司的外籍员工也按国内员工的政策进行了算税,一般此类员工的判断是取的花名册详情页-薪资页签-纳税人身份是居民还是非居民的设置。
花名册详情页的福利信息编辑后社保-员工福利档案会同步更新吗,会的
员工花名册详情页面绩效档案我直接在这里添加编辑的信息会同步到绩效模块吗,不会
在职证明可以下载吗,可以，在【员工-花名册-在职证明-打印】页面，目标打印机选择“另存为PDF”-保存即可
能批量开具证明吗,可以，在花名册勾选多个人员后点击开具证明
花名册信息太多了每次往后一拖就不知道哪行信息是我需要的了,"1.通过筛选关键信息进行搜索查看（例如员工姓名、所属部门）；
2. 表格相关设置-锁定前几列；表格相关设置-调整已选字段。"
我新增了退休返聘与驻家办公两个员工分类标签为什么在花名册这里看不到呢,将光标移动至“在职”按钮上，即可看到显示的小齿轮，点击勾选即可显示。
我看有些员工有试用期状态有些没有是什么原因呢,无【试用期到期日】时，【试用期状态】字段不展示；有【试用期到期日】，且待转正列表无记录时，【试用期状态】的值为【已转正】；有【试用期到期日】，且待转正列表有记录时，【试用期状态】的值为【试用期】
花名册出生日期能自动带出吗,先在“证件类型”上选择“居民身份证”，然后再填写身份证号码。必须按照此顺序进行编辑，若填写顺序不一致，将不会带出。
在APP公司通讯录里查看到的头像与上传的头像不一致是怎么回事,APP上传的是个人头像，通讯录展示的是员工-花名册里的头像。
信息变更走什么流程可以设置,信息变更只能由HR手动在员工档案-信息变更中查看并审批，员工可在App端，【我的】→【我的档案】中查看和编辑所有授权的花名册信息
我在APP上提交教育经历的修改在HR审批通过前可以重新提交一次吗,"不可以，需要HR审核之后才能再次提交。
需要管理员审批的位置在【员工】-【员工档案】-【信息变更】中。"
员工合同到期了重新签了合同期限在i人事怎么修改,如果不需要审批，点击【续签合同】；需要审批点击【发起续签审批】
历史合同信息怎么无法删除,有删除权限才会出现【删除】按钮
花名册详情中的合同信息与合同管理里的信息关联吗,关联，花名册的“合同信息”与【合同管理】的“合同记录”当前合同同步显示。
合同预警如何设置,"合同预警是自动的。
合同预警可以在【员工】-【合同管理】-【合同记录】页面进行查看。在【员工】-【员工设置】-【合同设置】里设置预警通知的提前天数。"
当前合同要到期了会有系统通知给负责人吗,可以在【账号】-【基础设置】-【消息模板设置】中设置合同到期提醒需要通知给的人员
编辑合同和变更合同有什么区别,变更合同会将之前的合同变为历史合同；编辑只是在原合同的基础上进行修改。
续签合同和发起续签审批有什么区别,"续签合同：省略续签审批过程，直接进行续签，生成一份新合同。
发起续签审批：审批通过后，再生成一份新合同。"
怎么发起电子签约签署续签合同,先在合同管理中维护当前需要续签的合同，然后发起电子签约。
我点击变更合同提示当前合同信息不完善是怎么回事,需要先把当前合同完善，红色带*号的都是必填项。
发起电子签约发起获取不了薪资,主管理员需要给子管理员薪资档案的查看权限。子管理员发起才可以获取薪资数据。
我们这个月才开始使用系统有很多历史合同怎么加到系统里面,员工-合同管理-合同记录-批量新增历史合同，可以批量导入
员工在i人事里但是发起电子签约跳转到法大大页面后找不到这名员工,如果是新员工入职，是马上去法大大电子签约那边排队，可能同步会有延迟。
这个电子签约时免费使用吗,不是，费用以系统上价格为准
电子签约记录可以允许领导查看本部门或企业内员工查看吗,员工可以到手机APP-我的-工作信息-查看合同记录；部门领导只能获得授权后，到后台合同管理页面查看
公司主体中添加不了公司名称,公司名称是只有通过选择的。若有新的公司名称要创建，在【组织】-【组织架构】-【法律实体】中进行创建。
认证中的社会信用代码怎么修改,如果是通过法人认证，可以在法大大界面直接填写新的信用代码就可以，法大大能编辑认证就可以，系统以法大大填的数据为准。
电子签约公司主体怎么变更管理员,"1.点击右上角的变更管理员，发送邀请，接收取决于员工设置-合同设置-实名认证邀请通知方式中配置的通知方式
2.新管理员实名并加入公司后，再次点击变更管理员选择对应新管理员
3.旧管理员会收到信息，点击确认后完成管理员变更操作（需要旧管理员提供验证码，完成变更）"
续签合同抓不到薪资档案数据,请检查下合同模板里是否有添加 “薪资档案”字段
印章没有编码是否有效,"1.实际公章是有编码的。系统自动生成的公章没有编码，仍然是具有法律效力的，完成实名认证并通过印章审核后，会生成一个CA证书，然后加盖到电子合同上后，用Adobe reader打开后，点击签章，有数字签名的信息，且是有效未修改的，具有法律效力。
2.系统这边横排文字会有8个字符的限制，公章编码如果超出了限制就没办法输入，如果线下的公章是有编码的，建议之后仍然使用本地上传，保证线上和线下公章一致。这边字符限制正在需求优化中。"
入职登记表入职审批都有为什么显示是已放弃,"入职操作流程：在个人设置-企业二维码（提供入职二维码供员工扫码填写入职登记表，填写完成提交后）-异动-入职-入职登记表（入职登记表审核，审核完成进入“审核结果”中）-待入职会有员工信息(若需要发起入职审批)-发起入职审批（审批完成后，请确认员工信息无误后）-待入职中点击员工确认入职
若相关审批没有完成，直接点击确认入职，则会显示已放弃。
处理方式：可在此处放弃入职或删除待入职员工数据，重新走入职流程。"
员工填了入职登记表提交后信息在哪,员工若提交了入职登记表，在【员工】-【异动】-【入职】-【待入职】-【入职登记表】中查看员工提交的信息，并完成审批。
为什么员工扫描入职二维码后hr查看不到入职登记表,"1.若员工入职登记表中有填写部门，可以看下hr账号是否有员工所选部门的管理权限。
2.若员工入职登记表没有填写部门，那就只有提供入职二维码的HR与超级管理员可以查看。"
为什么确认入职了还在待入职中,待入职的员工，到了入职日期才会进入已入职、花名册中。
入职登记表如果发现员工填写有问题可以退回去让员工重新填写吗,可以，在入职登记表审核界面点击退回即可
入职页面的入职审批是用于做什么的,查看入职流程的审批进度，有权限的HR可以操作【转审批人、同意、作废、撤回】
转正日期提醒在哪里设置,转正日期提醒是分开的，消息模板中可以设置接收人等；转正列表中的仅是反色显示提醒到HR的。
待转正列表没有待转正的员工是什么原因呢怎么没有新增按钮呢,待转正列表的员工数据来源于员工-花名册-试用期到期日是否填写。
如何撤销员工的转正,可以撤销转正，在转正-已转正列表点击员工姓名后面的操作按钮，点击“撤销转正”即可。
可以设置员工试用期到期后自动确认转正吗,"超级管理员账号勾选“试用期到期自动转正”
温馨提示：只有超级管理员账号能勾选该设置，子账号都不能勾选上"
我担心会错过时间没有及时给员工办理转正可以怎么设置提醒到我吗,"员工-异动-转正-待转正-设置提醒；
若是要收到消息提醒的，可以在【账号】-【基础设置】-【消息模板设置】中设置通知的对象。"
发起调动时无法选择新部门怎么办,调动审批有对应的数据权限，发起调动时也会受影响，请检查下图路径配置：
发起待调动时怎么新增调动原因,在账号-基础设置-选项设置中找到调动原因新增
员工没有调动中的审批发起调动提示有发起了的,检查是否有已撤回的调动审批，撤回的审批需要作废后才能重新发起
发生了调动个税扣缴义务人是自动变更吗,不行，需要请前往薪资-员工薪资档案中，修改个税扣缴义务人
如何增加调动类型选项设置,在账号-基础设置-选项设置中找到调动类型新增
发起调动审批为什么提示重复,在更多-调动审批中查看是否有这个员工没有作废的单据。若有已撤回的也请作废掉。才可以发起新的。
员工离职后之前审批人是员工怎么处理,确认离职时，会有审批交接选项，调整后审批人会自动更新成交接人：
有权限的子账号正确的离职步骤是什么,"1.先需要现在账号-权限管理-用户管理处，看是否需要移交离职子账号权限
2.再在用户管理处，看是否需要删除此离职员工？
3.以上确认后，最后进行正常进行后续离职操作即可
注意：如果有权限员工离职了，不移交权限，员工是仍然能登录账号查看设置的"
员工离职以后手机端还能看到相关信息吗,员工离职以后，员工的手机端就自动和后台解除了关联，手机端无法再登录，也看不到相关手机端的数据了。
离职交接的模板要怎么修改,在异动，离职交接，交接模板处可修改
系统离职工作交接是什么时候开始的,需要在离职审批通过后，再发起工作交接
没点确认离职这一步 怎么就到已离职里边去了,"1、确认是否是其他管理员点了确认离职
2、是否在【员工设置】-【离职设置】中设置了审批之后自动确认离职"
办理离职的员工为什么还存在于在职人员里,如果操作员工离职时，选择的离职日期是当天及以后日期的，办理离职后员工还是存在于在职人员列表里，到了离职日期的第二天会自动进入离职人员列表里。
HR如何办理员工离职,"HR可以在【员工】-【花名册】-【操作】-【离职】处由HR发起员工的离职申请。HR也可以在【员工】-【异动】-【离职】当中给员工办理离职
此情况适用于当员工没办法通过手机端办理离职时，或员工被动离职时，HR可以在此直接发起对该员工的离职程序。"
如何直接在花名册中改变员工的在职状态比如说从离职改为在职或从在职改为离职,"为了维护数据的严谨性，系统不允许直接修改员工的状态，否则将对数据的统一性产生影响。
1、如果想从离职改为在职，可以通过复职的方式办理。
2、如果想从在职改为离职：可以由HR直接在【员工】【异动】-【离职】发起该员工的离职，并提交给自己审批。审批通过以后，HR归档后，员工状态将自动变为离职。
3、如果该员工的数据已经无用，可以直接删除。删除以后的数据将不在系统里。请慎重使用。"
HR发起批量离职能否操作,在【员工】-【异动】-【离职】当中可以批量导入离职员工信息和批量确认离职。
离职员工怎么删除,【员工】-【花名册】，选择“已离职”类别员工勾选要删除的员工，点击页面左下方删除按钮即可。
员工可以申请当天离职吗,可以，在【员工】-【员工设置】-【离职设置】可以编辑员工提前申请离职的时间。
为什么已离职人员复职时在待入职列表中发起入职审批时提示证件号和花名册离职人员重复不可提交,"入职不是复职，复职员工不能走入职流程。
复职直接在【员工-花名册-已离职】列表，操作复职。"
员工入职了但是在异动记录里面查不到,"只有走入职流程的，才可以在【异动记录】里查看到到入职记录；
直接在花名册里面由HR操作新增的，在【异动记录】里面是查看不到的。"
请问现在异动记录的部门若操作调动是显示现在所在部门还是调动前所在部门,目前调动记录里面是原部门，现职位；异动记录里面是原部门，原职位。
为什么只授予子账号一个部门的权限他却可以看到整个公司的异动记录,目前异动记录没有数据权限控制。
人员流动分析表可以自定义时间范围吗,可以，在页面右上角选择时间范围查询
人员流动分析表的入职率和离职率可以自定义公式吗,目前不支持自定义公式
我有一些员工信息花名册里没有对应录入的地方应该怎么操作,员工-员工设置-自定义信息集-新增字段或子集
设置成无效的字段花名册是否还显示,设置无效。花名册则无此字段。
