提问,回答
考试已发布发现有个试题出错了怎么办,"考试已发布，发现一些试题有错字，可在对应的题库里修改；若答案错了，则可通过变通方式调整。
注意：随机的已考人员不会更新为最新的修改。
具体如下
1、路径：题库中心，在题库列表中，点对应题库最右的“…”，点击“管理试题”

2、找到相应的题目，点击编辑

3、在编辑题目页面，可对题目名称及题目选项进行文字上的修改。

4、不支持对题目答案的修改。
原因：比如一部分人已经完成了考试，那么答案变了，会影响到相关统计数据。
变通1：如多选题，答案应是ABCD，但是出题时出成了ABC，那可以把D项内容改成是错误选项，做个简单变通。
变通2：对无法更改的，告知学员该题有错，不计入成绩。"
培训申请勾选框时为什么有的无法选择,只有特定的状态可以勾选：待归档和审批中
为什么员工在发起"培训申请"时没有他想选的审批人,"在发起“培训申请”时需要员工自己选择审批人，员工只能查看并选择他有“通讯录查看权限”的人员
可以在如下图处进行设置"
培训已经发起了我勾选了全公司但有1个部门员工未被勾选进去,在发起培训后，勾选的部门下再新增一个子部门，子部门不会被默认勾选。
发起培训之后可以查到哪些培训是“面向新员工”的吗，是否可以修改不面向新员工呢,系统暂时不会显示员工为发起培训后新入职员工，所以在培训课程里无法查看到哪些是新员工，已经发起了培训的课程不可以重新修改不面向新员工，但是可以删除重新发起，或者直接重新发起。
已经通过的人员还可以在系统里发起补考吗,"已通过的人员不可以再为其发起补考；
只能为已经用完了所有可以考试的次数，并且还没有通过的员工发起补考"
为什么在培训安排-培训课程里有的课程我无法删除,子账号只能删除自己发起培训的课程，主账号可以删除所有账户发起的课程，如下图在此子账号里他无法删除不是他自己发起培训的课程。
如何为员工发起补考,"1.进入【培训安排】-【培训课程】点击“查看”

2.点击“发起补考”操作，员工在手机端就可以重新考试，发起补考只对单个人发起，不会增加课程的最大考试次数"
基础培训中培训课程的考试得分详情在哪里查看, 在基础培训-培训安排-培训课程中找到相应的课程查看得分即可，归档后可以在【培训安排-培训记录】或者【员工-员工档案-培训记录】查看，员工也会收到相应的培训是否通过的通知  
培训课程答完题后一定要归档员工页面才会显示结果对吗,是的，需要在培训课程中点击查看-然后点击查看考试情况，点击归档生效
在培训记录里有记录我无法导出和查看,如果该培训记录来自于培训通知里归档或者直接新增和导入的，所以没有办法导出和查看
修改花名册的数据培训记录会改变吗,修改花名册里员工的信息，培训记录里员工信息会同步改变
培训记录的数据从哪里来,系统目前培训记录的数据来源：（1）来自归档的培训课程；（2）来自归档的培训通知；（3）来自新增和导入
培训记录可以保存几年,只要没有删除，培训记录会一直保留的  
在哪设置签到二维码,在培训安排-培训通知，点击发起通知后，可以点击通知后面的【查看】，可以看到签到二维码
发起培训通知后添加部门那新部门中的人员可以收到消息吗,员工之前不在发起通知时所选择的部门，发起通知后修改员工部门为所选部门，员工可以在手机端收到通知
为什么系统里有些课件我无法删除,每个账号都只能删除自己上传的课件
收了费的课件我删除了重新上传还会收费吗,之前上传的时候收费了的课件，删除之后再上传需要重新收费
可以限制课件不允许员工在APP里下载吗,目前是无法限制员工课件的下载权限的，员工点开课件后，点击右上角的分享图标，会在员工手机的其他应用打开。
上传了的课件是创建课程时都可以共享使用吗,只要是在系统里的课件，其他账户在创建课程时都可以使用该课件
删除了培训资源里课程后原来的培训记录也会同时被删除吗,培训记录和培训安排里的培训课程都不会随着删除培训资源消失
培训考试不通过能不能不限制补考时间,不能，补考时间限制和培训资源-新建课程时设置的“考试间隔时间”有关， 修改课程内容后需要重新发起培训才可以按照新的设置生效，已经发起的培训不受影响。
为什么在培训资源-课程里有的课程我无法编辑、删除、发起培训,目前在【培训资源】-【课程】里，所有账户都只能对自己新增的课程编辑、发起培训、删除。
能设置不需要考试的课程吗,目前系统不支持设置不需要考试的课程
什么时候会进行课程设置的后续课程,在课程归档完成后，会自动进行后续课程，员工就可以在手机端查看到后续课程开始学习
有的课程需要发起，新员工才能看到，有的课程不用发起，新入职的员工直接就能看到这是为什么呢,在发起培训时选择是否包含入职之后的员工，如果选择不用重新发起新入职员工也可以在APP端查看到培训通知
已经选择部门发起了课程，修改员工部门后，员工还可以参加培训吗,修改员工部门后，员工仍然可以参加本次发起培训的课程。
在课程里“发起培训”后去哪里查看课程记录,在【课程】里“发起培训”后，可以在【培训安排】-【培训课程】里查看课程，点击“查看”查看参加培训人员的培训状态、分数等，管理员可以发起补考；点击“课程详情”查看课程的详细信息。
为什么在课程里“发起培训”时有些部门或人员我无法选择,有培训模块权限的子账号在【培训资源】-【课程】里“发起培训”，选择“适用部门或员工”时只能选择有数据权限的部门或员工，如需修改数据权限可以告知主账号进行数据权限的修改。
可以设置仅对新入职员工发起的培训吗,暂时不支持
删除了培训资源里的课程后已经发起的培训课程也会同时被删除吗,已经发起的课程不会自动被删除
为什么删除课程时提示课程被引用无法删除,"如果该课程是其他课程的后续课程，那么在删除时会提示此课程已经被引用，无法被删除。
如想删除可以编辑引用该课程的课程，将被引用的课程从后续课程中移除。"
培训课程答完题提示答案不能为空,填空题有几个空格就需要提交几个答案，否则会认为未填写完整
为什么引用考勤月报数据周期排序是乱的,"排序是根据本表设置的排序规则来的,  不是按照取数的数据周期。"
智搭云的流程审批意见字数限制,现阶段（2022年末）智搭云的流程审批意见仅限200字，如有超出200字的情况，请向售后支持人员反馈，以便及时对产品优化迭代提供场景支撑，谢谢。
怎么更改流程表单中的审批人,暂时仅支持当前审批人进行【转交】操作，主账号暂时无法操作干预变更。
怎么给HR子账号开通智搭云功能,由主HR账号在账号/权限管理/角色管理中，对需要使用智搭云功能的子账号进行关联。
为什么我的应用里没有计件工资日结的表单,创建系统内置的计件工资日结应用，系统将会自动生成默认的表单。
为什么有的表单设置没有【跨表数据读取】按钮,基准表不支持跨表数据读取，只有采集表和月核算表在设置页面右上角有【跨表数据读取】按钮。
数据中心的自定义薪资查询表和薪资台账的数据不一致,"1. 请确认报表搜索器条件设置是否与薪资台账一致

2. 如果原台账有撤回重算，请重新存档后且保持报表为实时存档模式，再次查看。"
可以把整个公司的绩效结果整合在一个报表里吗,可以。新建查询表，将【绩效档案表】中的字段添加到查询项目，如果需要在查询中再按【所属计划】或【部门】等筛选，可以点击【筛选条件】按钮，将所需要条件拖拽至条件列表，然后保存。
平均工资Top10报表介绍,"报表数据的统计范围
● 在薪资归档后，Top10报表会根据用户的数据权限按照部门、职位、职级三个维度分别统计基本工资和加班工资排名前十的数据。如遇部门/职位/职级当月基本工资或加班工资为0时，报表将自动隐藏该数据。
● 统计数据的显示以薪资存档时的数据为准，存档后员工的部门、职位、职级等变更不会影响报表的数据归集显示。如遇部门、职位、职级本身的更名，报表中会按照最新的名称展示。
● 举例说明1：员工在A部门-》进行薪资核算并存档-》存档后更新员工的部门数据为B部门
报表中部门及部门搜索会展示在A部门，员工的薪资数据也统计在A部门中
● 举例说明2：员工在A部门-》进行薪资核算并存档-》存档后A部门更名为A1部门
报表中部门及部门搜索部门名称显示为A1，员工的薪资数据统计在A部门中
注意事项
1. 薪资存档后如遇部门、职位、职级数据删除，报表会按照存档时对应名称进行展示
2. 同一员工在同月多次进行薪资存档，报表会按照该员工最后一次存档时的数据进行统计
3. 在职级体系中，若职级S1的适用序列为A和B，那么报表中S1职级下的薪资数据会统计A序列下S1职级的员工和B序列下S1职级的员工的薪资数据。
4. 在职级体系中，若C和D两个序列下分别有职级S1，那么报表中C序列下S1职级的员工薪资数据和D序列下职级S1的数据会分别进行统计。"
我可以将指定的某些报表推送给某个员工吗,"可以的。可以在数据中心-图表的右上角进行【推送设置】
1. 选择推送的报表
2. 选择接收人：部分负责人，指定员工（接收人请在员工自助PC端查看报表。）
3. 选择数据范围：指定部门或全公司
4. 设置推送频率：按天，按周，按月，或单次不重复
5. 设置推送渠道：站内信，邮件，短信，钉钉，企业微信（如果未对接钉钉或企业微信，将不可勾选）"
年龄分析表的【年龄占比】和【性别年龄占比】的统计区间是否可以自定义,系统暂不支持年龄区间自定义，可以将花名册年龄数据先行导出进行分析。
看板中的离职分析表是否可以按时间筛选数据,"离职分析报表是实时更新的，不能筛选时间，页面右上角为当前数据生成时间；
如果要看查看某个时间段的离职率，可以在员工-员工报表中查看【人员流动分析表】，此表可按月度|季度|年度|自定义进行筛选。"
仪表盘可以切换多种图标样式,仪表盘可以切换多种图标样式，并且将光标悬停在图标中时，会有浮动明细数据显示。
仪表盘怎么出数据,点击新增可以选择到【统计报表】中已创建的报表。
我想看下某个员工2022年的全年加班情况怎么导出报表,可设置自定义报表查看
请问智数模块里的员工离职率之类的数据能不能以表格形式导出,当前数据中心是不支持导出的，后续会更新上线此功能（导出Excel）
为什么报表中的离职人数和花名册导出的离职人数不一致,请确认是否开启了周期取数，如果开启，将按照所选时间定时存储报表快照，而非实时数据。
怎么查询某位员工全年的单位承担保险总数,在启用了社保模块，且每月生成准确的社保台账数据。可以使用分析表，
什么是行维度列维度,"1. 列维度、行维度不是具体的指标，而将指标按不同的维度划分一下。
2. 比如按性别维度（男、女）来划分，按员工类型（合同、劳务）来划分。
3. 而这些维度放在列就是列维度，放在行就行维度。"
怎么报表推送给指定人员查看,"一、 周期性的报表推送请使用【推送】功能
二、 临时性的报表分享，可以使用【分享】功能"
系统内置看板有哪些,"在下列已内置的看板基础上，系统持续更新中：
【人力分析】
员工结构分析：针对员工的在职人数、年龄、司龄、工龄、员工类型、学历、性别等基础信息进行分析
年龄分析：针对员工平均年龄、年龄占比、年龄排名等年龄指标进行分析，全面了解公司年龄结构
司龄分析：针对员工平均司龄、司龄占比、司龄排名等司龄指标进行分析，全面了解公司司龄结构
学历分析：针对员工学历占比等学历指标进行分析，全面了解公司学历结构

【运营分析】
异动分析：针对公司入职、转正、调动、离职等异动指标进行分析，全面了解公司人员流动情况
离职分析：针对部门离职排名等离职指标进行分析，全面了解公司离职情况
部门离职分析：针对部门离职率等离职指标进行分析，全面了解公司各部门离职情况
部门离职率：针对公司离职情况进行首年离职，首月离职，首周离职等不同维度分析，全面了解公司人员离职情况
综合出勤分析
出勤异常分析
人均出勤工时与加班工时
休假分析
招聘漏斗分析：招聘职位的漏斗、趋势、完成情况分析

【效能分析】
招聘专员分析：招聘专员的招聘进展分析
面试官效能质量分析：面试官在招聘环节的效能和质量分析
公司绩效分析：显示绩效计划中公司的绩效结果占比
部门绩效分析：显示绩效计划中各个部门绩效结果占比
月平均工资Top10：针对所属月的部门，职位，职级的平均工资top10进行分析

【决策分析】
招聘渠道分析：招聘渠道的贡献度分析"
系统默认的年龄分析区间不符合我们的要求,可以自定义分析表，创建个性化的年龄区间分析报表。
存档模式为什么不能按周取数,"1. 相较于实时报表，开启周期报表后，将按照所选时间定时存储报表快照；将无法修改表格字段和内置条件、搜索项。
2. 暂时不能直接设置为按日、按周创建取数，如果需要请联系售后服务支持人员或贵司专属客户成功经理。"
自定义报表添加不了教育经历里的专业信息,现阶段，自定义添加花名册信息时，仅支持添加基础信息分组的字段。
自定义薪资报表出现重复数据,"请检查一下内置条件是否只设置了【月】，而未设置【年】。
比如员工张三分别在2020、2021、2022年的9月都有数据，如果只设置了【月】，则可能会出现3条数据。"
前同事做的自定义报表我找不到是从哪里取的值,可以查看一下引用了数据的源表，会反色显示
自定义报表怎么查询自定义的薪资项,"报表可以从薪资台账或员工薪资档案中选择。
因为系统暂不支持跨源表选择字段，所以请确保需要选择的自定义薪资项与其它数据在同一个数据源。
1. 从薪资台账抓取，就需要核算存档时此字段存在。
2. 从薪资档案抓取，就需要设置为薪资档案可引用。


【方案】如果要在自定义报表中增加“试用期薪资”和“转正薪资”两个字段，那么就需要在薪资-薪资项目中添加这两个自定义薪资项，以报表中的薪资台账为例，如果要将这个字段加入薪资台账指标中，那么在添加好该两项薪资项后需加入方案核算存档，这样就可以在自定义报表中添加，如果是固定的薪资，可以将其加入薪资档案中，这样在薪资档案模块也能查询并添加进去"
报表可以设置分享吗,创建的报表允许分享给别人，点击共享范围，展示其他账号，可以设置仅可查看或可查看也可编辑。
同一张报表推送了两条钉钉提醒,如果钉钉自建用户在推送渠道同时设置了两个渠道，就会收到两条提醒。
自定义分析表的行和列可以增加上限吗,"现在系统仅对行维度和列维度有限制，分别10和2。对取值列字段上限是80个。
所以如果确实对行-列维度上限有特殊要求，请点击页面右上角-在线咨询-转人式反馈。
特别提醒 ：当行维度大于2或当前报表及行列转换后报表数据大于80列时，当前报表无法进行行列转换操作。"
报表怎么在APP查看,创建推送规则-设置推送渠道，即可在APP接收推送消息后点击查看。
统计报表导出并未按照筛选的部门排序,现有设计并未加入筛选条件排序，可在导出的Excel文件中完成排序。
为什么流程台账里都没有数据,需要主账号（主账号可见系统自带流程，以及子账号新建流程）分享下权限
如何转审批人,流程台账中进入审批详情，点击操作按钮选择转审批人
流程台账导出有几种导出方式分别是什么意思,导出（自定义导出，可自行勾选需要导出的内容）、导出全部（导出所有审批内容）、导出当前页（导出当前页面展示的审批内容）。
已经提交的审批有几种状态,审批中（还没有全部通过程）、已通过（所有流程均全部通过）、已驳回（有审批人进行驳回操作）、已作废（HR作废）、已撤回（申请人撤回）、已退回（审批人操作退回）。
点了抄送按钮抄送了人员在哪里可以看到抄送人, 在流程台账点击打印查看单据中添加的抄送人
审批人离职后更换审批人,管理员在流程台账-单据详情页中点击转审批人
为什么有些单据在流程调账搜索不到了,"系统归档规则：每月1号自动归档6个月前的数据。 可归档状态为：已同意、已驳回、已作废、已撤销； 不可归档状态：审批中、异常、已退回、已撤回。  
查看不到的单据需要在右上角“归档数据”中查看。"
怎么导出流程台账中的全部单据而不只是当前页的单据,选择全部数据后导出
归档数据中的单据可以删除或作废吗,仅支持查看和打印，不可删除或作废。
流程设置中可以更改审批图标吗,可以，在基础设置中选择要设置的图标即可。（ps：目前不支持上传自定义图标。）
点击下一步提示“条件1该条件设置有未填项”可是有条件内容呀,该提示需要检查条件1中是否有或的条件未填写，如果不需要可以删除条件后即可正在进入下一步。
流程台账中的附件可以查看到有哪些管理员下载了附件吗,目前不支持查看下载附件的相关记录。
HR在哪里可以催办审批单据,"可以在流程台账中点击“一键催办”
催办提醒的提醒方式：
在账号-基础设置-消息模板设置中勾选需要的提醒方式"
补卡审批设置审批人为空选择部门负责人但是流程转给了管理员,发起人的汇报对象为空，高级设置的转部门负责人是人存在的情况下处理的，若发起人的汇报对象设置了，但是离职或者被删除了，这种情况会触发高级设置中转部门负责人，当前发起人汇报对象直接没有，不会触发改逻辑。
提交假期申请后发现时间填写错了怎么处理呢,流程设置中设置了允许员工撤回，可以让发起员工直接撤回申请修改再提交，如果不允许员工撤回则需管理员作废申请单据后再让员工重新发起申请。
入职审批审批人没有操作过作废为什么流程列表里显示作废了,还在未通过状态的审批，如果管理员在员工-异动管理-入职中操作了“确认入职”，会提示放弃入职审批，放弃入职审批后，入职审批单据会被自动作废。
审批代理中是否可以设置自己代理自己的审批,会提示被代理人和代理人不能相同。
审批代理的时间可以精确到哪个时间单位,精确到小时。
审批代理是否可以选择多个代理人,同一审批流程同一时间只能选择一位代理人。但是同一时间范围内，可以选择多个代理人分别代理不同的审批流程。
A让B代理了审批 A还可以收到审批待办消息吗,可以收到，并且一样也可以进行审批。
审批代理设置,场景：公司某员工A休假一个月，休假期间无法对审批任务进行处理，委托同事B帮助其代理审批。
同一时间内A设置了B代理他的年假审批，B设置了C代理他的年假审批，这时间段内如果收到需要A审批的年假，C是否可以进行代理审批,不能，该条审批待办只会推送给AB两人，只能AB两人进行审批。
设置了一个流程但是在员工端看不到,"以下流程只能再HR端查看发起：
人事相关：入职，合同续签
招聘相关：录用审批
薪资福利：薪资福利台账审批、撤回，调薪审批"
录用审批中的工作地点无法正确带出来是为什么,需要在表单内将工作地点的字段设置为必填后，在流程中勾选表单相关字段才能正常带出；发起人中的工作地点字段无法带出
怎样设置离职审批,"找到人事相关，离职审批内进行设置
设置好了之后，在员工异动内，离职列表进行发起离职审批即可。"
能否给薪资核算设置审批流程,"可以的，在【薪资】-【薪资核算】，选择需要开启审批的方案，点击【规则设置】。
审批流程可在【审批中心】-【审批流程设置】进行详细设置。"
审批流程设置好了但是提请审批之后部门负责人带出来的结果和设置的不一致,申请人本身为部门负责人时，审批人设置中设置了“如果直接部门负责人是发起人本人，则向上查找上级部门负责人”，下一级审批人为申请人的部门负责人的场景下，会自动向上查找其上级部门负责人进行审批
主账号授予了我流程台账的权限但是我看不见审批内容,还需要在审批设置内，将该流程分享给子账号，才能在对应的审批列表内看到审批单据。
我设置好的审批流程看不见了,用户设置的时候，不要点 继续设置，点继续设置的话进入的是上一版本未发布的草稿数据，而上一版本的未发布的草稿数据就是没有任何审批节点的，进去就看不到设置的流程，设置的时候点 放弃 就可以了。（这是为了防止拥有该审批编辑功能的子账号都去点击审批设置，导致数据混淆，所以需要点击放弃，才能进入原始页面）
系统自带的人事与薪资福利审批，想要使用对应的套件在新增一个审批可以吗,人事套件可以使用在多个流程内，但是每个薪资福利套件仅能创建一个流程。
“或”条件是什么意思,例如在薪资费用审批中，薪资金额超过10万或者是薪资人数超过20人，就需要张三审批，就可以使用“或”条件。先设置条件金额大于等于十万，然后添加或条件，薪资人数大于等于20人。然后选择审批人为张三即可。
审批人空缺设置中有几个选项,自动通过、转管理员、作废、转部门负责人。
申请人关联字段是什么意思,选择了字段会自动带出申请人的基础信息。例如选择了手机号，就会自动将申请人的手机号带入表单内。需要注意的是，关联字段仅限在职员工。
加班套件内有补偿方式这一栏选项，但是为什么手机端申请的时候没有呢,如果加班规则设置的补偿方式是员工自主决定，这样手机端申请的时候对应的表单才会显示，如果设置的HR判定、转薪资或者转调休，这样就是不会显示的。
什么是会签与什么是或签,"会签
流程审批中，同一个节点出现多人审批时，须所有人同意才能通过，反之则不能通过。
或签
流程审批中，同一个节点出现多人审批时，有一票赞成则通过、有一票否决则退回，竞争执行，先执行审批的人决定这一节点的审批结果。"
同一个流程中重复的审批人可不可以跳过,当我们把流程固化以后，在部分流程中，可能出现同一个人审批多次的情况，这时建议大家设置“审批人去重”，请结合实际情况，选择去重的逻辑和规则。
条件的优先级怎么设置,"如果员工甲在流程分支中既满足A条件，又满足B条件，当A条件优先级大于B条件，则A条件生效，B条件自动忽略。
一般情况下，条件的优先级是按照添加顺序进行顺序排列的。"
